course_number,school_number,course_title,course_description,course_active,course_region,course_type,,,,,,,
CCT-130  ,33,Photovoltaic Systems Design and  Installation ,"This course will show students how to do solar site evaluations, electrical load calculations, solar system size calculations, and installation techniques. This course will help students design and install their own solar system and obtain skills for employment. ",1,Northern,,,,,,,,
CDI 60E ,35,SolidWorks,(Beginning) ,1,Northern,,,,,,,,
CDI 61E ,35,SolidWorks,(Intermediate) ,1,Northern,,,,,,,,
CDI 62E ,35,SolidWorks,(Advanced) ,1,Northern,,,,,,,,
CDI 63E ,35,SolidWorks,(SURFACES) ,1,Northern,,,,,,,,
CDI 64E ,35,SolidWorks,(PDMWorks) ,1,Northern,,,,,,,,
CDI 67E ,35,SolidWorks,(Simulation) ,1,Northern,,,,,,,,
CDI 70D ,35,Pro/ENGINEER Wildfire ,(Beginning),1,Northern,,,,,,,,
CDI 70E ,35,Creo Parametric ,(Beginning),1,Northern,,,,,,,,
CDI 71D ,35,Pro/ENGINEER Wildfire ,(Intermediate) ,1,Northern,,,,,,,,
CDI 71E ,35,Creo Parametric,(Intermediate) ,1,Northern,,,,,,,,
CDI 72D ,35,Pro/ENGINEER Wildfire ,(Advanced) ,1,Northern,,,,,,,,
CDI 72E ,35,Creo Parametric ,(Advanced) ,1,Northern,,,,,,,,
CDI 73D ,35,Pro/ENGINEER Wildfire ,(Pro/SHEETMETAL) ,1,Northern,,,,,,,,
CDI 73E ,35,Creo Parametric ,(Sheetmetal) ,1,Northern,,,,,,,,
CDI 74D ,35,Pro/ENGINEER Wildfire ,(Pro/SURFACE) ,1,Northern,,,,,,,,
CDI 74E ,35,Creo Parametric ,(Surfaces) ,1,Northern,,,,,,,,
CDI 75D ,35,Pro/ENGINEER Wildfire ,(Pro/MOLD) ,1,Northern,,,,,,,,
CDI 76D ,35,Pro/ENGINEER Wildfire ,(Pro/CABLE) ,1,Northern,,,,,,,,
CDI 77D ,35,Pro/ENGINEER Wildfire ,(Pro/MECHANICA) ,1,Northern,,,,,,,,
CDI 77E ,35,Creo Parametric ,(Mechanica) ,1,Northern,,,,,,,,
CDI 78D ,35,Pro/ENGINEER,(Windchill ProductPoint) ,1,Northern,,,,,,,,
CDI 79D ,35,Pro/ENGINEER Wildfire ,(Update) ,1,Northern,,,,,,,,
CDI 80D ,35,AutoCAD,(Beginning) ,1,Northern,,,,,,,,
CDI 81D,35,AutoCAD,(Intermediate) ,1,Northern,,,,,,,,
CDI 82D ,35,AutoCAD Civil 3D ,,1,Northern,,,,,,,,
CDI 83D ,35,AutoDesk Revit Architecture ,,1,Northern,,,,,,,,
CDI 85D ,35,AutoDesk Inventor ,,1,Northern,,,,,,,,
CIS 66 ,35,Intro. to Data Communication & Networking,"Concepts of communication, data communications and networks. Overview of connectivity options, common protocols, local and wide area networks.",1,Northern,,,,,,,,
CIS 76 ,35,Introduction to Network Security ,"Network security using the standard protocols and algorithms. All three goals of security including confidentiality, integrity, and availability will be discussed.  Attacks on security including active and passive are discussed and elaborated on. Two major techniques of security, cryptography and steganography, are described  with emphasis on cryptography. The emphasis is on mechanisms and services provided by the network security.",1,Northern,,,,,,,,
ES 58 ,35,Intro to Green Building,"An overview of strategies to implement a green building project within your organization. The strategies include model green building policy and guidelines including LEED (Leadership in Energy and Environmental Design), assembling a green team, assessing the impact of construction and buildings on society, and an overview of key stakeholders in the construction field.",1,Northern,,,,,,,,
ES 70 ,35,Intro to Energy Management Technology,"An overview of the field of Energy Management and its importance in today’s society, including future implications, and discussion of careers and impact on modern culture and society. This module introduces the whole building concept and related energy and conservation issues including the building envelope, HVAC systems, lighting, energy management and controls and renewable energy technologies.",1,Northern,,,,,,,,
ES 72 ,35,HVAC Systems,"An introduction to HVAC systems, the systems that provide heating, cooling, humidity control, filtration, and comfort control to facilities.  Examines various HVAC systems and their interrelationship with other building systems.  Students will consider HVAC technologies that can help facilities managers achieve the goals of lowering energy costs, becoming more environmentally friendly, and enhancing indoor air quality.",1,Northern,,,,,,,,
ES 74 ,35,Lighting Distribution Systems,"Provides an introduction to the fundamentals of lighting and energy management lighting techniques.  Discusses the different types of lifhting and day-lighting applications used in commercial and institutional buildings, while describing the quality and quantity of lighting needed for certain applications, measuring efficiency, color rendering, ballasts, etc. Lighting design that provides visual comfort at lower energy costs will be emphasized.",1,Northern,,,,,,,,
ES 75 ,35,Electric Power Systems ,"An introduction to electric power systems, focusing on distribution components such as transformers, switch-gear, distribution panels, and wiring. Power systems analysis, preventive maintenance, and record keeping techniques will be discussed. Emphasis will be placed on opportunities within a facility’s distribution system to save energy, increase equipment life, and reduce unscheduled outages.",1,Northern,,,,,,,,
ES 76A ,35,Solar Thermal Systems,"An overview of solar thermal systems including water heating technologies which reduce energy use to generate hot water including maintaining equipment and insulation, reducing hot water use and water temperatures, reducing heat losses from the system, and utilizing waste heat sources and renewable energy technologies, including solar.",1,Northern,,,,,,,,
ES 78 ,35,Energy Management Systems and Controls,"Describes the most commonly used controls and energy management systems in commercial and institutional applications. Topics will include complex automatic systems for major energy-consuming equipment, as well as simple controls, including time clocks, occupancy sensors, photocells, and programmable thermostats. Computer-based energy management systems, as well as control systems to reduce peak electrical demand will be discussed.",1,Northern,,,,,,,,
ES 79 ,35,Renewable and Alternative Energy Systems,"An introduction to the potential for renewable and alternative energy systems when adding power generation capacity for a site or large facility. Life-cycle cost comparisons between renewable energy systems and conventional power generation and the added potential of reducing peak power demand will be emphasized. Topics include photovoltaic power systems, wind energy systems, and fuel cells.",1,Northern,,,,,,,,
ESCI 61 ,35,Intro to PV Technology,"An introduction to the fundamentals of photovoltaic (PV) basics including how solar cells convert sunlight to electricity, solar potential, types of solar systems, system size requirement and design, net metering options, rebate programs, and related topics for your home or business.  An emphasis on the benefits of renewable energy technology as well as how to understand and review multiple bids and analyzing the economics of a PV installation. Good introductory course for students considering the North American Board of Certified Energy Practitioners certification program.",1,Northern,,,,,,,,
ESCI 63 ,35,PV Technology Field Project,"A PV technology field studies course emphasizing hands-on learning of solar angle/orientation and energy use calculation, PV systems design and installation for residential and commercial projects.  Good field studies course for students considering the North American Board of Certified Energy Practitioners certification program. ",1,Northern,,,,,,,,
ES 2,35,"Humans, the Environment and Sustainability","A study of human evolution, biology and ecology, including human civilizations, past and present, and the interaction with the environment. Environmental worldviews (ethics), past and present, of the various cultural, ethnic, gender and socioeconomic groups will be explored.",1,Northern,,,,,,,,
COMSC075,37,Comp Science I: Intro to Program Structures,"An introduction to computer programming concepts from a computer science perspective. Programming structures of sequential, selection and repetition are covered using a high-level object oriented language. Using existing classes and creating classes, methods, argument passing, program and data abstraction (including arrays) are covered. Documentation, programming style, and program design and development are addressed throughout the course.",1,Northern,,,,,,,,
COMSC 076 ,37,Comp Science II: Intro to Data Structures,"This course covers abstract data types and structures in an Object Oriented environment and the use of advanced programming techniques. Students will learn to reason mathematically about programs, including Big-O methods. The principles of encapsulation, abstraction, and polymorphism will be applied to large programming projects. The course will cover data structures and algorithms for such task as searching, sorting, and collections, using sets and list implement with arrays and link-list and to implement stacks, queues, trees, graphs, iterators and hashing.",1,Northern,,,,,,,,
CIT 030 ,37,Telecommunications and Computer Networks,"This course is intended for students who want a general introduction to telecommunications systems, network design and implementations, network applications, communications hardware, network management, and security, controls, and protocols.",1,Northern,,,,,,,,
CIT 060 ,37,Intro to Database Systems,"This course covers the basics of data modeling and database design. Students will learn a systematic approach to database design using entity-relationship models, normalization, and relational database design. The course also includes extensive up-to-date treatments of the standard database languages, SQL (Structured Query Language).  The increasingly important areas of object-based and object-relational database management systems will also be addressed.",1,Northern,,,,,,,,
ENGR 010,37,Engineering Processes & Tools,"This course introduces students to the engineering profession and the devices, processes, and techniques utilized in solving engineering problems.  Computers and associated components, hardware and software, are introduced.  The use of spreadsheets and mathematical software  in engineering problem solving and data presentation is discussed.  Engineering report writing and technical presentations are practiced in the class.  Students also learn the engineering process through a term project.",1,Northern,,,,,,,,
ENGR 018 ,37,Engineering Design & Graphics,"This course covers the principles of design and its graphical presentation in engineering as well as computer-aided design (CAD) and programming.  Major topics include the engineering design process,  orthographical projection, multiview drawing, pictorial drawings, dimensioning and tolerancing, and VBA programming.  Engineering graphical presentation is based on ANSI standard.  Students will learn to use CAD software in producing engineering drawings",1,Northern,,,,,,,,
ENGR 40 ,40,Intro to Clean Energy Technology,"Introduces the technical student to the field of clean energy technology, including modern energy systems and utility infrastructure, fossil fuel and renewable energy power generation, solar photovoltaic (PV) and wind technology, buildings as systems, green and LEED building, smart energy and active distribution (microgrid concept), transportation energy and advanced transportation solutions, and the future of sustainable energy systems. Overview of the energy industry, environmental and economic considerations, and key research and policy areas for clean and sustainable energy solutions. Provides students with a conceptual framework and foundation to proceed to more advanced study, as well as exploring emerging clean energy careers.",1,Northern,,,,,,,,
CIS 52A ,40,Intro to Data Management Systems,"Introduction to database systems and data management.  Topics include database definitions and concepts, data models, relational database, client/server database, distributed database, object-oriented database, business intelligence and data warehouses, transaction management and concurrency control, database administration and security, database connectivity and web technologies, database performance, databases in e-commerce, and hands-on experience with database management. ",1,Northern,,,,,,,,
CIS 78 ,40,Software Engineering,"A language-independent study of current software development methodologies.  The stages of systems analysis product design, implementation and testing are practiced. Collaborative, interactive design and technical writing are problem solving techniques learned.",1,Northern,,,,,,,,
CNET 54A ,40,Network Fundamentals & the TCP/IP Protocol Suite,"This course is designed to provide students with classroom and laboratory experience in current and emerging networking technologies. Instruction includes networking, network terminology, cabling, cabling tools, network protocols, network standards the OSI model, LANs, WANs, routers, network topology, IP addressing TCP, and network standards.",1,Northern,,,,,,,,
CNET 50 ,40,Intro to Computer Networking,This is a survey course designed to provide interested students with an overview of current networking technologies.,1,Northern,,,,,,,,
CIS 54D ,40,Microsoft SQL Server Implementation & Maintenance,This course provides students with the knowledge and skills in implementing and maintaining a database using Microsoft SQL Server 2008. ,1,Northern,,,,,,,,
APEL 128 ,40,Programmable Logic Controllers; Low-Voltage Systems & High-Voltage Systems,"Introduction to programmable controllers, alarm systems, telephone wiring, instrumentation, and high voltage testing.",1,Northern,,,,,,,,
APEL 129A ,40,Electrical Systems,This class will cover the 2005 National Electrical Code & Electrical Systems based on the 2005 NEC.,1,Northern,,,,,,,,
COIN 61 ,40,Publishing on the Web Using HTML/XHTML,"Introduction to electronic publishing on the Web using HTML and XTHML  using current standards.  Students will produce a validated multi-page Web site with image, text, and links; tables, frames, forms and simple multimedia. Students will upload and modify documents to a web server, understand client interactions, and planning, designing, testing and maintaining of a Web site. ",1,Northern,,,,,,,,
COIN 63 ,40,Advanced Topics in Web Publishing,Exploration of advanced technologies in Web publishing which work with Hypertext Mark-up Language and electronic publishing on the Web. ,1,Northern,,,,,,,,
ENGR 39 ,40,"Energy, Society and the Environment","Guides the general education student through humanity’s efforts to harness and generate energy, for industry, work, habitat and recreation. ",1,Northern,,,,,,,,
ENGR 41 ,40,Power Systems,"Introduced students to the field of modern power systems, from electrical power generation to transmission and distribution to electrical power networks in buildings.",1,Northern,,,,,,,,
ENGR 42 ,40,Solar PV Systems,"Introduces students to the field of photovoltaic technology, including design, fabrication technology, commercial applications and grid incorporation.",1,Northern,,,,,,,,
ENGR 43 ,40,Smart Energy Systems (Smart Grid),"Introduces students to the emerging field of smart energy systems, active power management and smart grid.",1,Northern,,,,,,,,
EST 56C ,41,Industrial Electronics ,"Application of electronic principles in the industrial environment. Emphasis on power circuits, control circuits and electronic components. ",1,Central,,,,,,,,
EST 59 ,41,Instrumentation Systems ,"Basic instrumentation and control concepts with application in process control systems. Calibrating, terminology, and Piping and Instrument Diagram (P&ID) symbols as established by the Instrumentation, Systems, and Automation Society. ",1,Central,,,,,,,,
EST 58 ,41,Programmable Logic Controllers ,"Programmable controllers, basic programming of programmable logic controllers, and input/output device interfacing. ",1,Central,,,,,,,,
CIT 57 ,41,Wireless Networking ,"Basic understanding of wireless networking. Plan, design, and configure wireless networks and equipment. Basic security for wireless networks. Prepare for the Certified Wireless Network Administrator (CWNA) exam. ",1,Central,,,,,,,,
CIT 58C ,41,Network Security Fundamentals ,"Provides a comprehensive overview of network security. Covers a full range of security concepts and techniques used in the business environment. Prepares students to become CompTIA Security+ certified. Covers authentication methods and common network attacks with strategies to protect a business against these attacks. Explores various network devices and media, and the proper use of perimeter topologies, extranets, and intranets to establish network security. Introduces basic cryptography and basic operational and organizational security measures. ",1,Central,,,,,,,,
CIT 58D ,41,Network Defense and Countermeasures ,"Examines the practice and techniques of intrusion detection to deter network attacks against business information technologies. Provides a comprehensive overview of intrusion detection design, and implementation, virtual private networks, packet filters, and network traffic signatures. Prepares students to take the network defense and countermeasures exam for the security certified professional (SCP) which is an industry standard security certification. ",1,Central,,,,,,,,
CIT 58E ,41,Network Defense and Countermeasures ,"Comprehensive overview of firewalls and their use with other network security components Perimeter devices and concepts are covered to provide a secure business environment. Prepares students for industry standard security certifications. Covers authentication methods, packet filtering, proxy servers, and encryption strategies to protect business information systems. ",1,Central,,,,,,,,
CIT 45 ,41,Data Communications ,"Essential elements that make up data communications including transmission media, local area networks, wide area networks, network interconnections, network management, security, network applications, and related technologies. ",1,Central,,,,,,,,
CIT 40 ,41,Computer Operating Systems ,"Principles of computer operating systems. A survey and comparison of the graphical user interface along with the command line interface using various operating systems such as Microsoft Windows and Linux, etc. ",1,Central,,,,,,,,
CIT 50 ,41,Fundamentals of Networking ,"Implementing and supporting a Microsoft Windows network infrastructure. For product support professionals who will be responsible for installing, configuring and supporting a Microsoft Windows network infrastructure. Prepare students for the MCSE exam. Fundamentals of UNIX using Solaris.",1,Central,,,,,,,,
EST 61 ,41,Networking Essentials ,"Local Area Networks fundamentals. Providing a theoretically rich, hands-on introduction to networking and the Internet. First class in a series of four in preparation for the CISCO CCNA Certification. ",1,Central,,,,,,,,
CSCI 30 ,41,PROGRAMMING IN THE PASCAL LANGUAGE ,"Introduction to programming in PASCAL; syntax; control and data structures; design development, style, documentation, testing, and maintenance of software; arrays, functions, procedures, records, and files. Students who have limited programming experience are advised to take this course prior to Computer Science 40. ",1,Central,,,,,,,,
ENGR 4 ,41,Engineering Materials ,"Properties of engineering materials and their relation to atomic structure. The effect of microstructure on the mechanical, electrical, magnetic and thermal properties. Phase equilibria and strengthening processes for metals, ceramics, and polymers.",1,Central,,,,,,,,
EST 62 ,41,Routing Protocols and Concepts,"Local Area Network routers, including basic router configuration and routing protocols. Second class in a series of four for preparation for the Cisco CCNA Certification.",1,Central,,,,,,,,
EST 63 ,41,Advanced Routing and Switching,"How to configure a switch for basic functionality and how to implement Virtual LANs, VTP, and Inter-VLAN routing in a converged network. The different implementations of Spanning Tree Protocol in a converged network are presented, and students develop the knowledge and skills necessary to implement a WLAN in a small-to-medium network. The third class in a series of four in preparation for the CISCO CCNA Certification.",1,Central,,,,,,,,
EST 64 ,41,Advanced Networking and Management,"WAN technologies and network services; implementation and configure of data link protocols and WAN security concepts, principles of traffic, access control, and addressing services. Fourth class in a series of four in preparation for the CISCO CCNA Certification.",1,Central,,,,,,,,
EST 66 ,41,Building Multilayer Switched Networks,"Multilayer Switching teaches students about the deployment of state-of-the-art campus LANs. Students will develop skills in the following areas: Campus Networks, Virtual Local Area Networks (VLANs), Spanning Tree Protocol, Inter-VLAN Routing, and Configuring Switches to Support Voice. Second class in a series of four in preparation for the CISCO CCNP Certification.",1,Central,,,,,,,,
EST 68 ,41,Optimizing Converged Networks,"Introduces students to optimizing and providing effective QOS techniques in converged networks operating voice, wireless and security applications. Fourth class in a series of four in the preparation for the CISCO CCNP Certification.",1,Central,,,,,,,,
EST 269A ,41,Fund of Network Security-Firewalls,"Security policy design and management; security technologies, products, and solutions; firewall and secure router design, installation, configuration, and maintenance.",1,Central,,,,,,,,
CSIS 181 ,42,PC Hardware,"This course introduces students to network security concepts and prepares them for computer systems and network management duties. This course covers security concepts, communications and infrastructure security, basic cryptography, and operational and organizational security. May be repeated twice for credit. This course has the option of a letter grade or pass/no pass.",1,Central,,,,,,,,
CSIS 182 ,42,Operating Systems,"This course will survey current computer operating systems such as Microsoft Windows 98, NT, 2000 and XP. Linux will also be covered. Topics include file system management, systems requirements, network systems integration, security, and regular maintenance procedures. This course has the option of a letter grade or pass/no pass.",1,Central,,,,,,,,
CSIS 178 ,42,Applied Networking,"This course covers fundamental networking concepts and develops the skills and knowledge to set up and maintain small business/home networks. The course is not hardware or vendor specific. It helps students prepare for the “Network +” certification exam, an industry- wide, vendor-neutral certification program developed and sponsored by the Computing Technology Industry Association (CompTIA). This course has the option of a letter grade or pass/no pass. May be repeated three times for credit.",1,Central,,,,,,,,
CSIS 179 ,42,Intro to Info Security,"This course introduces students to network security concepts and prepares them for computer systems and network management duties. This course covers security concepts, communications and infrastructure security, basic cryptography, and operational and organizational security. May be repeated twice for credit. This course has the option of a letter grade or pass/no pass.",1,Central,,,,,,,,
CSIS/DM/LIB 6 ,42,Web Page Authoring I,"An introduction to using Hypertext Mark-Up Language (HTML) and Extensible HTML (XHTML) to create web pages which can be uploaded and displayed on the World Wide Web. Students will use HTML/XHTML to create web pages with text in various sizes and colors, links to other sites, background color or patterns, graphics, tables and mailto links. Principles of design and color as they apply to screen presentations will be included. This course has the option of a letter grade or pass/no pass. May be repeated three times for credit.",1,Central,,,,,,,,
CSIS/DM 7 ,42,Web Page Authoring II,"This course is a continuation of CSIS 6, Web Page Authoring I. Topics that will be covered include XHTML, frames, advanced tables, forms, scripting languages, image maps, Cascading Style Sheets (CSS), and new trends in web page technology. This course has the option of a letter grade or pass/no pass. May be repeated three times for credit. This course is also listed as DM 7.",1,Central,,,,,,,,
CSIS 46 ,42,C++ Programming II,"This course is a continuation of CSIS 45, intended for students majoring in programming and/or planning to transfer to a 4-year college or university Computer Science program. The course will cover topics discussed in CSIS 45 in more detail. In addition the course will cover more advanced C techniques such as pointers, recursion, and linked lists. Special emphasis will be placed on C++ features such as classes, objects, templates and operator overloading. This course has the option of a letter grade or pass/no pass.",1,Central,,,,,,,,
ENGR 3 ,42,"Electrical Circuits, Devices and Systems","Natural, forced, and steady-state response by impedance, exponential, pole-zero and phasor methods; solid state; digital circuits and laplace transform methods are introduced.",1,Central,,,,,,,,
CSS 31 ,43,Database Management,"Introduces the fundamental concepts of database management. Topics include the database environment, development, entity-relationship model, object-oriented modeling, logical database design, physical database design, client/server and middleware, SQL, database access, distributed databases, administration and warehousing. Hands-on experiences with a full range of database topics demonstrate practical use of databases.",1,Central,,,,,,,,
