course_number,school_number,course_title,course_description,course_active,course_region,course_type,,,,,,,
110,1,Introduction to Product Development,,1,Northern,Class,,,,,,,
128,1,Computer-Aided Mechanical Design,,1,Northern,Class,,,,,,,
146,1,Energy Conversion Principles,,1,Northern,Class,,,,,,,
C218,1,Introduction to MEMS Design,,1,Northern,Class,,,,,,,
C231A,1,Experiential Advanced Control Design I.,,1,Northern,Class,,,,,,,
C232,1,Advanced Control Systems I.,,1,Northern,Class,,,,,,,
235,1,Design of Microprocessor-Based Mechanical Systems.,,1,Northern,Class,,,,,,,
239,1,Advanced Design and Automation,,1,Northern,Class,,,,,,,
290P,1,New Product Development: Design Theory and Methods,,1,Northern,Class,,,,,,,
290Z,1,"Topics in Control, Modeling and Optimization",,1,Northern,Class,,,,,,,
122,1,Introduction to Communication Networks,,1,Northern,Class,,,,,,,
C128,1,Feedback Control Systems.,,1,Northern,Class,,,,,,,
144,1,"Fundamental Algorithms for Systems Modeling, Analysis, and Optimization",,1,Northern,Class,,,,,,,
192,1,Mechatronic Design Laboratory.,,1,Northern,Class,,,,,,,
219C,1,Computer-Aided Verification,,1,Northern,Class,,,,,,,
C220A,1,Advanced Control Systems I,,1,Northern,Class,,,,,,,
224B,1,Fundamentals of Wireless Communication.,,1,Northern,Class,,,,,,,
249,1,"Embedded System Design: Models, Validation, and Synthesis.",,1,Northern,Class,,,,,,,
287,1,Advanced Robotics.,,1,Northern,Class,,,,,,,
161,1,Computer Security.,,1,Northern,Class,,,,,,,
186,1,Introduction to Database Systems.,,1,Northern,Class,,,,,,,
C191,1,Quantum Information Science and Technology.,,1,Northern,Class,,,,,,,
195,1,Social Implications of Computer Technology.,,1,Northern,Class,,,,,,,
C219D,1, Concurrent Models of Computation.,,1,Northern,Class,,,,,,,
260,1, User-Interfaces to Computer Systems.,,1,Northern,Class,,,,,,,
261,1,Security in Computer Systems.,,1,Northern,Class,,,,,,,
261N,1,Internet and Network Security,,1,Northern,Class,,,,,,,
268,1,Computer Networks.,,1,Northern,Class,,,,,,,
276,1,Cryptography.,,1,Northern,Class,,,,,,,
171,1,Introduction to Design of Human Work Systems and Organizations.,,1,Northern,Class,,,,,,,
253,1,Supply Chain Operation and Management.,,1,Northern,Class,,,,,,,
220,1,"Modeling Energy, Environmental, and Resource Systems.",,1,Northern,Class,,,,,,,
C226,1,Photovoltaic Materials; Modern Technologies in the Context of a Growing Renewable Energy Market.,,1,Northern,Class,,,,,,,
254,1,Electric Power Systems.,,1,Northern,Class,,,,,,,
280,1,Energy Economics.,,1,Northern,Class,,,,,,,
X423,1,Smart Grids: Introduction,"Learn about the new intelligent energy grid that supports the green-energy initiatives of the 21st century. Study real-world value propositions, business perspectives and solution scenarios from business economics and technical practicalities points of view.",1,Northern,Class,,,,,,,
X423.2,1,Smart Grids: Command and Control,"In this survey course, you first review the communication technology for distribution automation of AC energy and then advance into technology trade-off considerations. You build a foundation for understanding the control network.",1,Northern,Class,,,,,,,
X423.1,1,Smart Grids: Energy-Efficient Transmission,learn about the challenges of high-power interconnections and review quality considerations.,1,Northern,Class,,,,,,,
X423.4,1,Smart Grids: Internet of Things,"Taking smart energy grids as a model, you investigate topics such as wireless sensor network issues, the role of middleware, radio frequency identification (RFID) and sensor network technologies and security and privacy issues",1,Northern,Class,,,,,,,
X423.3,1,Smart Grids: Metering and Home Area Networks,"Gain a solid technical foundation for understanding smart meters and home power networking, including Open HAN system requirements, modern wireless sensor networks, home automation and ZigBee Smart Energy",1,Northern,Class,,,,,,,
X423.5 ,1,Smart Grids: Microgrids,"Variety of microgrid topics, including distributed generation, wind, photovoltaics, fuel cells, supervisory control and data acquisition (SCADA) systems, securing smart grids, matching community needs, smart meters and devices.",1,Northern,Class,,,,,,,
 ,1,Introduction to Sustainability Management,"Sustainability in the context of environmental, economic, and social forces that shape emerging policies and management decisions. Investigate the possibility of creating a common set of sustainability principles",1,Northern,Class,,,,,,,
 ,1,Climate Change and Law AB 32: What It Means for You,"Learn requirements set forth in AB 32 and other laws, and gain a solid understanding of related issues.",1,Northern,Class,,,,,,,
x436,1,"Energy for Sustainability: Technology, Planning and Policy","Evaluate policies, regulations, and laws at the local and state level. Learn how energy strategies impact residential and commercial sectors, corporations, and governments. Examine issues in science, technology, policy, law, and business",1,Northern,Class,,,,,,,
x435,1,Energy Use and Climate Change,Examine the threat from the lack of significant incentives to change behavior and shift habits toward sustainable energy consumption in the United States. Study the fundamental impacts from current energy use and the support infrastructure.,1,Northern,Class,,,,,,,
ER24,1,"Freshman Seminar: The science, technology, policy, and politics of California air pollution","California experiences the nation’s worst air quality. Its innovative regulatory program is a model for the nation and the world. This seminar examines current California air pollution issues including health-based air quality standards and the problems of their attainment, the next generation of clean cars, California’s evolving role in addressing global warming, and more. This seminar is an unusual opportunity to explore air pollution and climate change issues with a professor who also led relevant California regulatory programs.",1,Northern,Seminar,,,,,,,
ER102,1,Quantitative aspects of global environment,"Application of basic principles of natural science to the analysis of human influence on environmental conditions and processes at continental to global scale. Topics covered include dimensions of the physical world and of human modifications of it; techniques of estimation and back of the envelope calculation; box models of environmental stocks and flows: equilibrium and feedback; chemical equilibria in the environment; nutrient cycles and their disruptions; acid deposition and its consequences; climate change and its consequences; stratospheric ozone depletion; sources, fate and effects of toxic substances in the global environment; radioactivity and radiation; epidemics; biodiversity and its diminution; carrying capacity and human population growth.",1,Northern,Seminar,,,,,,,
ER180,1,Ecological economics in historical context,"Economists through history have explored economic and environmental interactions, physical limits to growth, what constitutes the good life, and how economic justice can be assured. Yet economists continue to use measures and models that simplify these issues and promote bad outcomes. Ecological economics responds to this tension between the desire for simplicity and the multiple perspectives needed to understand complexity in order to move toward sustainable, fulfilling, just economies",1,Northern,Seminar,,,,,,,
ER190-001,1,California Water,"California, technically a desert on average, provides extremely interesting examples of the politics of water, the social and environmental consequences of water development, and the relationships between water uses and energy. This course provides the historical, legal, environmental, and economic background needed to understand the current social and ecological challenges of providing water for a growing population and major economy, now also made more complex by climate change.",1,Northern,Seminar,,,,,,,
ER190-002,1,Behavior and sustainability (ERG Doctoral Student Facilitated),"The aggregated effects of billions of individual decisions each day have large adverse effects on human and ecosystem health, natural resource stocks, and global climate change. While the causes of environmental degradation are anthropogenic, so too are the solutions. This course examines different perspectives on the motivations of human behavior, drawing on diverse disciplines, including psychology, economics, and sociology. Theories of behavior change and behavioral intervention case studies will inform student efforts to design viable programs that promote improved sustainability through behavior change.",1,Northern,Seminar,,,,,,,
ER C226,1,Photovoltaic materials; modern technologies in the context of a growing renewable energy market,This technical course focuses on the fundamentals of photovoltaic energy conversion with respect to the physical principals of operation and design of efficient semiconductor solar cell devices. This course aims to equip students with the concepts and analytical skills necessary to assess the utility and viability of various modern photovoltaic technologies in the context of a growing global renewable energy market. Also listed as Materials Science and Engineering C226.,1,Northern,Seminar,,,,,,,
ER 273,1,Research methods in social sciences,"This course aims to introduce graduate students to the rich diversity of research methods that social scientists have developed for the empirical aspects of their work. Its primary goal is to encourage critical thinking about the research process: how we ""know,"" how we match research methods to research questions, how we design and conduct our information/data collection, what we assume explicitly and implicitly, and the ethical dilemmas raised by fieldwork-oriented studies. The course will be broad rather than deep; it is a step toward, and not a substitute for, in-depth courses on interviewing or regression analysis or the philosophy of knowledge.",1,Northern,Seminar,,,,,,,
ER 280,1,Energy Economics (Roomshare with ER C180 and EnvEconC180),This course explores input-output and cost benefit analysis applied to energy; exhaustion theory and economics of energy supply; patterns of energy use; trade-offs in energy conservation; the effect of energy policy on supply and demand; projecting future energy and resource supply and use. Prerequisites: Economics 100A or equivalent; basic calculus or linear algebra.,1,Northern,Seminar,,,,,,,
ER C283,1,Information and Communications Technology for Development,"This seminar reviews current literature and debates regarding Information and Communication Technologies and Development (ICTD). This is an interdisciplinary and practice-oriented field that draws on insights from economics, sociology, engineering, computer science, management, public health, etc.",1,Northern,Seminar,,,,,,,
MBA 212,1,Energy and Environmental Markets (Offered through business and engineering),"In the past 30 years, some of the largest industries have transitioned from regulated to market-based paradigms.  Managers in many transportation, information technology, and energy companies have had to devise strategies to cope with changes in economic and environmental regulations and the evolution of new markets and trading platforms.  The energy industries feature a complex mix of regulation and market-driven incentives.  Over the last decade, industries that had previously been viewed as staid and conservative have been rocked by deregulation initiatives, the California electricity crises, the Enron scandal, rising commodity prices, and now the challenge to reduce greenhouse gases.  Drawing on the tools of economics and finance, we study the business and public policy issues that these changes have raised in energy markets. Topics include the development and effect of organized spot, futures, and derivative markets in energy; the political economy of deregulation; climate change, environmental impacts and policies related to energy production and use; privatization of publicly owned energy assets; market power and antitrust; and the transportation and storage of energy commodities. We examine the economic determinants of industry structure and evolution of competition among firms in these industries; investigate successful and unsuccessful strategies for entering new markets and competing in existing markets; and analyze the rationale for and effects of public policies in energy markets.",1,Northern,Seminar,,,,,,,
ER 291-001,1,Science and Regulatory Policy (enrollment limited to ERG students only),"This seminar will examine the use, misuse, and abuse of the scientific process and scientific information in regulatory decisions. Topics covered will include the role and limits of science, use of scientific information in the regulatory process, identifying and controlling improper political interference, and judicial review of science-laden agency decisions. Many examples will be drawn from environmental and natural resource regulation, but the course will range well beyond those topics.",1,Northern,Seminar,,,,,,,
Er 282C,1,Master's project seminar (for ERG students only),"Required of second-year ERG Master's candidates. Topics include the adoption of a research project, research design, presentation of work, statistical analyses. Students will apply the interdisciplinary methods, approaches, and perspectives learned in the core curriculum. Sequence begins fall each year. Credit and grade to be awarded upon completion of the full sequence.",1,Northern,Seminar,,,,,,,
ER 295,1,Colloquium,"Presentations of research in energy issues by faculty, students, and visiting lecturers. Master's degree students required to enroll for three semesters.",1,Northern,Seminar,,,,,,,
ER 286,1,PhD Seminar,,1,Northern,Seminar,,,,,,,
ER 298N,1,Directed group study sustainability in Action: Cal Climate Action Course,This is an interdisciplinary course addressing both theoretical and practical aspects of campus sustainability; students will undertake individual or group projects to address particular sustainability issues on campus. Prerequisites:Graduate standing.,1,Northern,Seminar,,,,,,,
ER 229,1,Individual Research,,1,Northern,Seminar,,,,,,,
ER 301,1,Graduate Student Instructor Practicum,ERG students only - employed as Graduate Student Instructors.  Permission of instructor before enrolling.  This course does not meet the pedagogy requirement for first-time GSIs.  Seehttp://gsi.berkeley.edu/faculty/300courses.html for open courses.,1,Northern,Seminar,,,,,,,
ER 602,1,INDEPENDENT STUDY DOCTORAL STUDENTS,To be used by ERG students only preparing for qualifying exams. ,1,Northern,Seminar,,,,,,,
,2,Sustainability and the Built Environment,"This introduction to the Green Building and Sustainable Design Certificate Program highlights large-scale planned communities, infill sites and individual structures from the U.S. and other nations, as well as how these buildings are serviced and managed.",1,Northern,Class,,,,,,,
,2,"Sustainable Planning, Environmental Site Design and Development","Learn about fundamental sustainability issues and processes as they apply to community planning and site design situations. Discover how to identify key challenges when incorporating sustainability into planning strategies, policies and site design, and examine technical and environmental factors of site design. ",1,Northern,Class,,,,,,,
,2,Sustainable Water Management in Site Design and Development,"Incorporate a sustainable water resources approach into urban development and its related infrastructure at the planning, design and construction stages.",1,Northern,Class,,,,,,,
,2,Green Architecture,"Explore the issues, challenges and opportunities associated with green building and sustainable design. Examine innovative residential, commercial, industrial, mixed-use, and low- and high-density specialty buildings. Evaluate the micro- and macro-economic issues associated with green buildings.",1,Northern,Class,,,,,,,
,2,Green Building Materials and Construction Methods,"Learn to implement green building practices into homes, apartments, business complexes and office buildings. Utilize materials and techniques that promote healthy, durable and environmentally responsible construction. ",1,Northern,Class,,,,,,,
,2,"Energy Sources, End Uses and Impacts",Examine the energy issue from the macro perspective of the built environment to the micro approach of how heat flows throughout a building.,1,Northern,Class,,,,,,,
,2,Green Building Design Studio,Apply what you learned in the Green Building and Sustainable Design or Renewable Energy certificate programs to a real-world example.,1,Northern,Class,,,,,,,
,2,Introduction to Energy Resource Management,"Examine the four major components of energy management--supply, demand, regulation and environment--and the concepts and principles behind successful energy management.",1,Northern,Class,,,,,,,
,2,Energy Resource Management: Supply,"Learn to conduct market assessments and to develop sourcing and procurement strategies. Topics include energy management control systems, natural gas purchasing opportunities in the spot market, thermal energy storage, alternative energy supplies, energy security and energy trading.",1,Northern,Class,,,,,,,
,2,Energy Resource Management: Regulatory,"Learn the difference between regulations and tariffs pertaining to electrical generation, transmission and distribution and those pertaining to gas production, transmission and distribution.",1,Northern,Class,,,,,,,
,2,Energy Resource Management: Demand,"Familiarize yourself with an overview of Leadership in Energy and Environmental Design (LEED). Amp up your knowledge of: the latest lighting technologies and products, project management, fleet operation and maintenance, verification of energy savings, and best practices and benchmarking. ",1,Northern,Class,,,,,,,
,2,Energy Resource Management: Environment,"Explore the range of environmental issues affected by energy use. Gain perspectives on current trends and technologies. Examine the environmental fundamentals--planning, development and implementation--of WAGES (water, air, gas, electricity and steam) and renewable energy systems",1,Northern,Class,,,,,,,
,2,Energy Resource Management: Leadership,Examine the leadership issues involved in managing energy from organizational behavior and change management to project management and communication skills.,1,Northern,Class,,,,,,,
,2,Sustainability and the Built Environment,"Explore sustainability as it relates to the built environment—from the economic, environmental and social-equity perspectives. Learn how researchers and analysts define sustainability, as well as how they measure and track progress. ",1,Northern,Class,,,,,,,
,2,"Energy Sources, End Uses and Impacts","From solar panels and exterior shades to lighting a space and painting a roof white, learn how to analyze energy use as an effective strategy to promote energy conservation in the built environment.",1,Northern,Class,,,,,,,
,2,Green Building Design Studio,Apply what you learned in the Green Building and Sustainable Design or Renewable Energy certificate programs to a real-world example.,1,Northern,Class,,,,,,,
,2,Cogeneration and District Solutions,"Gain an overview of micro-cogeneration and district energy solutions for commercial and district applications. Learn about cogeneration system selection and sizing, preliminary feasibility study approaches, heat to power ratios, computer programs, economic and environmental issues, emerging technologies and regulations.",1,Northern,Class,,,,,,,
,2,Bioenergy Systems Design,"Explore the environmental, economic and social impacts. Learn about emerging bioenergy technologies, legislation and regulations.",1,Northern,Class,,,,,,,
,2,Geothermal Energy Systems Design,Gain the necessary knowledge to understand the promise and limitations of geothermal heat pump installation and direct use applications.,1,Northern,Class,,,,,,,
,2,Small Wind Energy Systems,"Learn to design and install a small wind system for residential and commercial applications. The class will examine: how to measure wind and estimate energy output; small wind system types and components; wind system selection and site criteria; economic issues; public concerns; permitting; installation, safety, operation and maintenance criteria; emerging technologies, legislation and regulations; and case studies. ",1,Northern,Class,,,,,,,
,2,Solar Photovoltaic (PV) Energy Systems Design,"Learn the basics of solar photovoltaic power systems for both residential and commercial use, as well as solar system physics and technology, design and implementation.",1,Northern,Class,,,,,,,
,2,Solar Thermal Energy Systems Design,Learn the fundamentals of designing and installing these power systems for residential and commercial applications and work in teams to design a solar thermal energy system.,1,Northern,Class,,,,,,,
,2,Solar Photovoltaic (PV) Energy Systems: Overview,"Gain useful background information about the solar resources in California and the various federal and state government initiatives to promote solar energy as a mainstream power source, including the latest policies and legislation. Learn about the California Solar Initiative and its future implementation, utility interconnection and net metering issues.",1,Northern,Class,,,,,,,
,2,Solar Thermal Energy Systems: Overview,"Gain practical information about industry trends and state-of-the-art technologies. Learn about the actual market situation and how to grow your skills in consulting, planning and design, economics and marketing.",1,Northern,Class,,,,,,,
,2,Solar Photovoltaic (PV) Energy Systems Design,"Learn the basics of solar photovoltaic power systems for both residential and commercial use, as well as solar system physics and technology, design and implementation.",1,Northern,Class,,,,,,,
,2,Solar Thermal Energy Systems Design,Learn the fundamentals of designing and installing these power systems for residential and commercial applications and work in teams to design a solar thermal energy system.,1,Northern,Class,,,,,,,
,2,Solar Photovoltaic (PV) Energy Systems: Compliance and Code Overview,"Learn about design and installation compliance issues for both residential & commercial solar energy systems in the areas of system sizing, array layout, electrical wiring and utility interconnection.",1,Northern,Class,,,,,,,
152,2,Computer-Aided Mechanism Design,,1,Northern,Class,,,,,,,
154,2,Mechatronics,,1,Northern,Class,,,,,,,
268,2,Wind Power Engineering,,1,Northern,Class,,,,,,,
272,2,Theory and Design of Control Systems,,1,Northern,Class,,,,,,,
274,2,Analysis and Design of Digital Control Systems,,1,Northern,Class,,,,,,,
276,2,Data Acquisition and Analysis,,1,Northern,Class,,,,,,,
132A,2,RF and Microwaves in Wireless Communication,,1,Northern,Class,,,,,,,
132B,2,RF and Microwaves in Wireless Communication,,1,Northern,Class,,,,,,,
132C,2,RF and Microwaves in Wireless Communication,,1,Northern,Class,,,,,,,
151,2,"Instrumentation Interfacing, Signals and Systems",,1,Northern,Class,,,,,,,
158,2,Control System Design Methods,,1,Northern,Class,,,,,,,
172,2,Microcomputer-Based System Design,,1,Northern,Class,,,,,,,
173A,2,Computer Networks,,1,Northern,Class,,,,,,,
173B,2,Design Projects in Communication Networks,,1,Northern,Class,,,,,,,
180A,2,Digital Systems I,,1,Northern,Class,,,,,,,
228,2,Advanced Microwave Circuit and Device Design Techniques,,1,Northern,Class,,,,,,,
252,2,Multivariable Control System Design,,1,Northern,Class,,,,,,,
274,2,"Internet Measurements, Modeling and Analysis",,1,Northern,Class,,,,,,,
153,2,Computer Security,,1,Northern,Class,,,,,,,
155,2,Computer Security for Non-Majors,,1,Northern,Class,,,,,,,
160,2,Introduction to Software Engineering,,1,Northern,Class,,,,,,,
165A,2,Database Systems,,1,Northern,Class,,,,,,,
165B,2,Database Systems,,1,Northern,Class,,,,,,,
166,2,Scientific Data Management,,1,Northern,Class,,,,,,,
222A,2,Design and Analysis of Algorithms,,1,Northern,Class,,,,,,,
227,2,Modern Cryptography,,1,Northern,Class,,,,,,,
228,2,Cryptography for E-Commerce,,1,Northern,Class,,,,,,,
235A,2,Computer and Information Security,,1,Northern,Class,,,,,,,
236,2,Computer Security: Intrusion Detection Based Approach,,1,Northern,Class,,,,,,,
257,2,Mobile and Wireless Networks,,1,Northern,Class,,,,,,,
186,2,Environmental Remote Sensing,,1,Northern,Class,,,,,,,
195,2,Integrating Environmental Science and Management,,1,Northern,Class,,,,,,,
MGMT X430.12,3,"Introduction to Corporate Social Responsibility, Sustainability and Green Business ","The explosion of corporate social responsibility into mainstream business decision-making has been fueled by an unprecedented number of recent environmental, financial, legal, social and climate events.",1,Southern,Class,,,,,,,
SOCECOL X416.5,3,Legal Developments Concerning the Environment and Climate Change,"A general sense of urgency, and the realization that there is little time to waste, has given rise to a host of legislative and regulatory enactments. Review global and federal developments, with particular attention on developments in California.",1,Southern,Class,,,,,,,
SOCECOL X417.21,3,Framework for Strategic Leadership,The course will also provide an overview of the LEED system for sustainable construction; examine traditional professional and contract liabilities and how these liabilities and associated risks may be expected to play out in the new arena of sustainability.,1,Southern,Class,,,,,,,
MGMT X461.63,3,Green Marketing Principles: Winning Strategies for a New Era,"Socio-economic, cultural and legislative pressures are creating an inevitable tide towards a future in which companies will be more socially responsible and provide cleaner and more efficient products and services that damage the planet less. ",1,Southern,Class,,,,,,,
