course_number,school_number,course_title,course_description,course_active,course_region,course_type,,,,,,,
CIT 021 ,52,Cisco Networking Fundamentals,"This course is the first of four courses leading to the Cisco Certified Network Associate (CCNA) designation. This course introduces the architecture, structure, functions, components, and models of the Internet and other computer networks. It uses the OSI and TCP layered models to examine the nature and roles of protocols and services at the application, network, data link, and physical layers. The principles and structure of IP addressing and the fundamentals of Ethernet concepts, media, and operations are introduced to provide a foundation for the curriculum. Labs use a “model Internet” to allow students to analyze real data without affecting production networks. Packet Tracer (PT) activities help students analyze protocol and network operation and build small networks in a simulated environment. At the end of the course, students build simple LAN topologies by applying basic principles of cabling, performing basic configurations of network devices, including routers and switches, and implementing IP addressing schemes.",1,Northern,,,,,,,,
CIT 023 ,52,LAN Switching and Wireless,"This course is the third of four courses leading to the CCNA designation. This course provides a comprehensive, theoretical, and practical approach to learning the technologies and protocols needed to design and implement a converged switched network. Students learn about the hierarchical network design model and how to select devices for each layer. Students learn how to configure a switch for basic functionality and how to implement Virtual LANs, VTP, and Inter-VLAN routing in a converged network. The different implementations of Spanning Tree Protocol in a converged network are presented, and students develop the knowledge and skills necessary to implement a WLAN in a small-to-medium network. This course may be offered via distance learning.",1,Northern,,,,,,,,
CIT 025 ,52,Implementing Cisco IP Routing,"This course teaches students how to implement, monitor, and maintain routing services in an enterprise network. Students will learn how to plan, configure, and verify the implementation of complex enterprise LAN and WAN routing solutions, using a range of routing protocols in IPv4 and IPv6 environments. The course also covers the configuration of secure routing solutions to support branch offices and mobile workers. Comprehensive labs emphasize hands-on learning and practice to reinforce configuration skills. This course may be offered via distance learning.",1,Northern,,,,,,,,
CIT 011 ,52,Desktop Operating Systems,"This is the first of a two-course program designed to prepare students for the A+ certification exam. The course provides a complete, step-by-step approach to learning the fundamentals of supporting and troubleshooting computer software. This course uses CompTIA A+ training materials to equip the student with the knowledge and skills necessary to become proficient in core computer principles for the software component. This course is beneficial for any postal maintenance or information systems personnel involved with the installation, upgrade, and troubleshooting of microcomputer (PC) software. This course may be offered via distance learning.",1,Northern,,,,,,,,
ENGR 025 ,52,Engineering Graphics and Design,"This course develops graphical visualization and design skills by applying graphics based engineering methods. The course also teaches engineering design by applying the conceptual design process and integrating graphics into design projects. Graphics assignments develop sketching, manual drafting, and computer aided drafting (CAD) skills. This course is primarily for engineering transfer students.",1,Northern,,,,,,,,
CSIS 75 ,54,Intro to Comp Hardware/A+ Prep,This course covers maintenance and installation of computer hard­ware and basic electronics to understand digital circuits. The class covers most of the A+ certification material. May be taken four times based on a new version of software.,1,Central,,,,,,,,
CSIS 76 ,54,Networking Fundamentals,"This course introduces networking concepts and builds basic networking skills. Students learn layered models (TCP/IP and OSI), Ethernet networking, routing, IP addressing, and cabling. This Cisco Academy course is the first of a four-part sequence to prepare for CCNA certification. Portions of instruction may be offered online. May be taken four times for recertification.",1,Central,,,,,,,,
CSIS 198 ,54,Network Security Fundamentals,"This course covers the fundamentals of security, using simulators to give hands-on experience with servers, routers and other security devices. Students learn about different types of attacks, security policy, encryption, access control, PKI, authentication, and cryptography. This course covers material necessary to prepare for the CompTIA Security+ certification. May be taken four times for recertification. Also offered online.",1,Central,,,,,,,,
CSIS 180 ,54,Adv. Routing & Switching Implementations,"This course explores advanced topics in routing and switching at the Cisco Certified Network Professional (CCNP) level. The student will learn to configure the multi-cast routing, multi-area OSPF, EIGRP and BGP routing protocols as well as how to optimize routing updates through redistribution, route filtering and route maps. The course introduces advanced switching concepts such as Ether channel and Multi-layer Switching. May be taken four times for recertification. Offered online.",1,Central,,,,,,,,
CSIS 10B ,54,Comp. Science Advanced Programming,"Students gain further experience in software design by developing and using common data structures in Java. Coverage includes arrays, strings, linked lists, stacks, queues, trees, sorting, searching and hashing, and a significant project.",1,Central,,,,,,,,
CSIS 51C ,54,Database Processing,"This introductory course to database management and design provides a solid, modern foundation in the fundamentals of database processing. Students are introduced to objects and SQL databases including a survey of MS Access, Oracle, and SQL Server. Database publishing and Internet standards are introduced with XML Schema and coverage of ODBC, OLE DB, ADO, ASP, and other technology.",1,Central,,,,,,,,
BUSC 132 ,54,Web Publishing Using MS FrontPage,"This course provides students a hands-on introduction to basic aspects of World Wide Web publishing using Microsoft FrontPage. With a self- paced syllabus, material is presented in a visual format to describe essential skills to plan, create, modify and structure Web pages and sites. May be taken four times based on a new version of software.",1,Central,,,,,,,,
ENGR 12 ,54,Engineering Circuits,"This course introduces DC and sinusoidal circuit analysis as applied to resistive, capacitive, and inductive circuits, op-amps, transformers and balanced three-phase circuits. Topics include Thevenin and Norton circuit theorems, superposition, complex phasors and power, frequency response, resonance, and associated calculations.",1,Central,,,,,,,,
ENGR 50 ,54,Robotics,"This is a hands-on introduction to modern robotics using the industry standard BASIC Stamp microcontroller. Topics include construction, movement, object detection/avoidance, programming PBASIC, subsumptive programming and emergent behavior. Students may purchase their own robotics kit or use school-provided kits. No prior electronics experience needed.",1,Central,,,,,,,,
CSIS 112 ,54,Configure & Secure your Home Network,This course covers the basics of configuring and securing file and printer sharing in a wired and/or wireless home network as well as how to establish Internet connectivity through a DSL or cable router.,1,Central,,,,,,,,
CSIS 78 ,54,Adv. Publishing on the World Wide Web,"This course builds on basic client-side Web publishing skills using Web design software and coding of HTML, XHTML, XML and scripting. Effi­cient and effective Web site design is emphasized using class projects. Dynamic HTML is studied using scripting and Cascading Style Sheets, data binding, and Java applet objects. Visual presentation is explored using image creation software while Macromedia Flash is introduced. May be taken four times based on a new version of software.",1,Central,,,,,,,,
CISN 110 ,55,Networking Fundamentals,"This course provides a comprehensive overview of the fundamental concepts of computer networking. It is designed to make the student aware of the various elements, protocols and software within the networking environment.",1,Northern,,,,,,,,
CISN 120 ,55,Network Administration,"This course provides students with the knowledge and skills necessary to perform post-installation and day-to-day network administrative tasks in single-domain and multipledomain networks on Microsoft® Windows NT ®, Microsoft® Windows 2000 ®, and Microsoft® Windows XP ®.",1,Northern,,,,,,,,
CISN 130 ,55,Network Technical Support,"This course provides students with the knowledge and skills necessary to install, configure, customize, and troubleshoot Microsoft® Windows NT ®, Microsoft® Windows 2000 ®, and Microsoft® Windows XP ® in a single-domain network. In addition, students learn how to integrate Microsoft® Windows networks with other platforms such as Novell NetWare and UNIX networks.",1,Northern,,,,,,,,
CISN 165 ,55,Network and Comp Security,"This course provides students with the knowledge and skills necessary to install, configure, customize, and troubleshoot Microsoft® Windows NT ®, Microsoft® Windows 2000 ®, and Microsoft® Windows XP ® in a single-domain network. In addition, students learn how to integrate Microsoft® Windows networks with other platforms such as Novell NetWare and UNIX networks.",1,Northern,,,,,,,,
CISA 160 ,55,Database,"Provides an introduction and hands-on training in the use of microcomputer database software. The basic concepts of Structure as well as specific commands and functional capabilities will be covered. Files will be created, data manipulated, output formatted, and reports produced. Students will gain experience in modular programming techniques and constructing program loops. Specific applications will include batch mode, interactively finding and editing data, and simultaneously accessing two databases to isolate exception conditions or update files.",1,Northern,,,,,,,,
ENVS 115 ,55,"Energy, the Environment & Sustainability ","This course is a study of human civilizations and their impact on global environmental systems. Environmental world views (ethics), past and present, of the various cultural, ethnic, gender and socioeconomic groups will be explored.",1,Northern,,,,,,,,
GEOG 121 ,55,Geographic Info Systems & Science,"This second course in Geographic Information Systems (GIS) and Science further enhances the student’s studies by adding extensions to their knowledge of computer-based techniques for storage, retrieval, analysis, and representation of spatially referenced data. It emphasizes the applications of GIS technology to research problems such as natural hazard mapping, surface runoff, environmental impact assessments, business trends, and others. Students are required to develop system models in their chosen field area.",1,Northern,,,,,,,,
GEOG 130 ,55,Intro to Satellite Based (GPS) Data Collection Methods,"This course will describe principles and applications of control surveys, coordinate systems, and global positioning systems including concepts and practice of navigation, location, data collection, processing and adjustment.",1,Northern,,,,,,,,
CAOT 148 ,56,Comp Applications in Biotechnology,"This course introduces basic computer skills necessary to perform tasks required in an introductory biotechnology course. This course covers key concepts in Excel, PowerPoint, and Access.",1,Northern,,,,,,,,
CNET 150 ,56,Network Operating Systems,"This course provides an in-depth study of Network Operating Systems. The web-based curriculum, sponsored by Hewlett-Packard Company, is an intensive introduction to multi-tasking network operating systems. Characteristics of the Linux, Windows 2000, NT, and XP network operating systems will be discussed. Students will explore a variety of topics including installation procedures, security issues, back up procedures, and remote access. This course provides the foundation for student preparing to take the CompTIA A+ certification exam.",1,Northern,,,,,,,,
CNET 152 ,56,Data Communications,"This course is an introduction to data communications. It will include Internet, e-mail, modems, communication protocol, local area networks, wide area networks, network design, and management.",1,Northern,,,,,,,,
CNET 155A ,56,Network Fundamentals,"This course introduces the architecture, structure, functions, components, and models of the Internet and other computer networks. It uses the OSI and TCP layered models to examine the nature and roles of protocols and services at the application, network, data link, and physical layers. The principles and structure of IP addressing and the fundamentals of Ethernet concepts, media, and operations are introduced to provide a foundation for the curriculum. At the end of the course, students build simple LAN topologies by applying basic principles of cabling; performing basic configurations of network devices, including routers and switches; and implementing IP addressing schemes. This course is preparation for the Cisco Certified Networking Associate (CCNA) certification.",1,Northern,,,,,,,,
CNET 183 ,56,Implementing Cisco Secure WANs CCNP II,"This is the second of four courses of the advanced study of Cisco Networking Academy. Students will gain classroom and laboratory experience in current and emerging networking technology that will prepare them for the Cisco Certified Networking Professional (CCNP) exam: 642-825 Implementing Cisco Secure WANS (ICSW). Instruction includes DSL, PPPoE, PPPoA, MPLS, Frame Relay, VPN, how to build a remote access network to interconnect central sites to branch offices and home office/telecommuters, and to control access to the central site, as well as maximize bandwidth utilization over the remote links.",1,Northern,,,,,,,,
CNET 185 ,56,Optimizing Converged Networks,"This is the last of four courses of the advanced study of Cisco Networking Academy. This course is designed to provide students with classroom and laboratory experience optimizing converged networks that will prepare them for the Cisco Certified Networking Professional (CCNP) exam: 642-845 Cisco Optimizing Converged Cisco Networks). Instruction includes troubleshooting methodology, network documentation, and debug.",1,Northern,,,,,,,,
CNET 105 ,56,PC Hardware and Software,This course includes hardware and software topics relevant to personal computer (PC) troubleshooting. Emphasis is placed on developing essential troubleshooting and repair skills and preparation for the A+ certification exam.,1,Northern,,,,,,,,
CNET 142A ,56,Linux Networking,"This course introduces the functions and features of the Linux operating system in Network. The course describes the major client and server services that are found in most networked computer systems. Students will implement in the computer lab such services as telnet, ftp, nfs, nis, web, mail, dns, samba, and dhcp. This course is preparation for Sair Linux and GNU certification.",1,Northern,,,,,,,,
CNET 158 ,56,Wireless Networks,"This introductory course to wireless communication and LANs focuses on the design, planning, implementation, operation and troubleshooting of Wireless LANs. It covers a comprehensive overview of technologies, security, and design best practices with particular emphasis on hands on skills.",1,Northern,,,,,,,,
CNET 170 ,56,Network Security,"This course provides an in-depth study of Network Security fundamentals and provides a comprehensive overview of network security. The class is broken down into five sections: General Security Concepts, Communication Security, Infrastructure Security, Cryptography, and Operational/ Organizational Security. This course provides the foundation for students preparing to take the CompTIA Security+certification exam.",1,Northern,,,,,,,,
ENGI 101 ,56,Intro to Engineering,"This course explores the field of engineering and its different branches. It provides hands-on design projects including experimentation, team work, ethics, and the application of basic scientific principles to practical situations.",1,Northern,,,,,,,,
ENGI 130 ,56,Electric Circuit Analysis,"This course is a study of DC and AC linear circuits and transient and steady state analysis. Experimental techniques, instrumentation, and circuit simulation will be covered in the lab.",1,Northern,,,,,,,,
CS 124 ,56,Programming with Data Structures,"This course involves the study and implementation of data structure programming techniques. The emphasis is on the data structures of stacks, queues, lists, trees and graphs; the use of recursion; and the application of these tools primarily in searching and sorting. Students will implement these concepts by writing numerous programs in an object-oriented language such as C++.",1,Northern,,,,,,,,
CS 152 ,56,Data Communications,"This course is an introduction to data communications. It will include Internet, e-mail, modems, communication protocol, local area networks, wide area networks, network design, and management.",1,Northern,,,,,,,,
CNET 142B ,56,Linux Security ,Students with Linux experience will gain knowledge and skills in implementing Linux security. This course is preparation for Sair Linux and GNU certification.,1,Northern,,,,,,,,
ENGI 120 ,56,Engineering Mechanics – Statics,"This course is a study of force systems and equilibrium in two and three dimensional structures, distributed forces, friction, and virtual work.",1,Northern,,,,,,,,
CNET 140B ,56,Linux System Administration,"This course introduces the fundamental knowledge and skills needed to install, manage, and maintain a Linux computer system. Advanced system management tasks like file system management, patching, rebuilding the kernal, configuring networking interfaces, and system monitoring are performed in the computer lab. Shell programming and the various shells are introduced, and students will learn to write shell script programs to perform various system tasks. This course is preparation for Sair Linux and GNU certification.",1,Northern,,,,,,,,
CNET 154 ,56,Network Technician Training,"This course prepares students for the knowledge and skills required to successfully install, operate, and troubleshoot a small branch office network. The course includes topics on networking fundamentals; connecting to a WAN; basic security and wireless concepts; routing and switching fundamentals; the TCP/IP and OSI models; IP addressing; WAN technologies; operating and configuring IOS devices; configuring RIPv2, static and default routing; implementing NAT and DHCP; and configuring simple networks.",1,Northern,,,,,,,,
CNET 155B ,56,Routing Protocols and Concepts,"This course describes the architecture, components, and operation of routers, and explains the principles of routing and routing protocols. Students analyze, configure, verify, and troubleshoot the primary routing protocols RIPv1, RIPv2, EIGRP, and OSPF. By the end of this course, students will be able to recognize and correct common routing issues and problems. This course is preparation for the Cisco Certified Networking Associate (CCNA) certification.",1,Northern,,,,,,,,
CNET 156A ,56,LAN Switching and Wireless,"This course focuses on the technologies and protocols needed to design and implement a converged switched network. Students will learn how to configure a switch for basic functionality and implement virtual LANs, VTP, and Inter-VLAN routing in a converged network. The different implementations of Spanning Tree Protocol in a converged network are presented and students will develop the knowledge and skills necessary to implement a WLAN (wireless LAN) in a small-tomedium network. This course is preparation for the Cisco Certified Network Associate (CCNA) certification.",1,Northern,,,,,,,,
CS 131/BIOT 131 ,56,Computing Concepts in Biotechnology,"This course introduces the basic computing concepts, the most commonly used computer algorithms, and programming languages in biotechnology.",1,Northern,,,,,,,,
CNET 135 ,56,Database Fundamentals I: Database Architecture and Administration,"In this course students learn to startup and shutdown a database, create a database, manage file and database storage, and manage users and their privileges. In addition, students learn to organize the database and to move data into and between databases. Hands-on practices help to reinforce key concepts and students have an opportunity to troubleshoot real life issues when they are given examples of typical problems encountered when operating an Oracle database.",1,Northern,,,,,,,,
CNET 136 ,56,Database Fundamentals II: Database Backup and Recovery,"This course addresses backup and recovery techniques and examines various backup, failure, restore, and recovery scenarios for current versions of Oracle databases. Participants utilize multiple strategies and Oracle tools such as Recovery Manager to perform backups and restore and recovery operations. Participants have the opportunity to apply some of the more advanced techniques within a workshop environment. In addition to lecture and hands-on learning, this class addresses answers to frequently asked questions concerning backup and recovery.",1,Northern,,,,,,,,
CNET 160A ,56,Microsoft Client Operating Systems,"This course provides students with the knowledge and skills necessary to set up and support the Windows Client Operating System and prepare for the corresponding Microsoft Certified Professional (MCP), a core requirement on the MCSA and MCSE track. Students will get practical experience installing, administering, and troubleshooting this next-generation desktop environment.",1,Northern,,,,,,,,
ETEC 106 ,56,Electronics for Technology,"This class is an introduction to electricity and electronic devices. Students will learn the basic theory of electricity and apply that knowledge to build, test, and troubleshoot electrical circuits. In the lab, students will learn to operate the test and measurement instrumentation necessary to support construction of electrical circuits.",1,Northern,,,,,,,,
CNET 140A ,56,Linux Installation and Configuration,"This course introduces the functions and features of the Linux operating system including the file system, system services, processes, background processing, scheduling, and security. The course supplies students with the information they need to install and configure Linux on a personal computer. Students will get practical experience in installing, administering, and troubleshooting Linux systems. This course is preparation for Sair Linux and GNU certification.",1,Northern,,,,,,,,
CNET 162B ,56,Windows Network Infrastructure Administration,"This course prepares students as product support professionals who will be responsible for installing, configuring, managing, and supporting a network infrastructure that uses the Microsoft Windows Server products and prepare for the corresponding Microsoft Certified Professional (MCP) Exam, a core requirement on the MCSE track and elective credit on the MCSA track.",1,Northern,,,,,,,,
ENVS 104 ,56,Solar Photovoltaic Design and Installation ,"Introduction of solar photovoltaic system requirements, design and configurations, installation techniques, and their application in residential and commercial construction. Entry-level Certification Exam from NABCEP is an option.",1,Northern,,,,,,,,
ENVS 105 ,56,Energy: Development and Sustainability,"This course is an exploration of the conversion and use of energy, on the nature of energy and energy systems, how different cultures use and view energy, and the use of energy in contemporary societies. This course will explain the origin and dimensions of the global energy problem and identify how energy issues and policies affect environmental quality, economic growth, and global politics. The course will focus on how energy conservation, energy efficiency, and renewable energy sources can be incorporated to create a sustainable society.",1,Northern,,,,,,,,
ENVS 106 ,56,Wind Energy: Design and Development ,"This course explores the role of wind as an energy source, as well as its social, economic, and political implications on the global energy supply. Surveys in historical wind energy application will be conducted, its reliability assessed, and environmental implications analyzed. Also studied will be wind energy applications and basic operating principles. The status of the industry’s future and renewable energy as a whole will be analyzed.",1,Northern,,,,,,,,
ENVS 107 ,56,Intro to Sustainable Agriculture ,This course examines how changes in the way we eat and farm impact the environment and how traditional and evolving methods of farming can reduce our environmental impact and feed our populations sustainably.,1,Northern,,,,,,,,
ENVS 109 ,56,Urbanization: Towards Green Communities,"This course presents the sociological, economical, and sustainable perspective in the investigation and understanding of urban phenomena. Included are a wide range of topics that tap the spectrum of urban growth and development in both the developed and developing world.",1,Northern,,,,,,,,
CS 104B ,56,Advanced .NET Programming,This is an advanced course for .NET application design and development. Three major areas covered are Graphical User Interface for Windows applications; ADO.NET and SQL for access to databases; and XML and ASP.NET for Web forms and services. The .NET Framework will be used in class for program development.,1,Northern,,,,,,,,
